{
  "people": [
    {
      "person_key": "name_company:priya-example@larkspur-ledger",
      "name": "Priya Example",
      "title": "Vice President, Marketing",
      "target_role": "VP Marketing",
      "match_type": "exact",
      "evidence_date": "2026-10-20",
      "months_ago": 0,
      "date_basis": "page_live",
      "freshness": "current",
      "confidence": "medium",
      "source_ids": [
        "S1"
      ]
    },
    {
      "person_key": "name_company:sam-sample@larkspur-ledger",
      "name": "Sam Sample",
      "title": "Chief Financial Officer",
      "target_role": "CFO",
      "match_type": "exact",
      "role_since": "2025-03",
      "evidence_date": "2026-10-20",
      "months_ago": 0,
      "date_basis": "page_live",
      "freshness": "current",
      "confidence": "high",
      "source_ids": [
        "S1",
        "S2"
      ]
    },
    {
      "person_key": "name_company:lee-placeholder@larkspur-ledger",
      "name": "Lee Placeholder",
      "title": "Head of Demand Generation",
      "target_role": "Head of Demand Generation",
      "match_type": "exact",
      "evidence_date": "2025-06-12",
      "months_ago": 16,
      "date_basis": "event",
      "freshness": "possibly_stale",
      "confidence": "low",
      "source_ids": [
        "S3"
      ]
    }
  ],
  "roles": [
    {
      "role": "VP Marketing",
      "status": "found",
      "people_count": 1
    },
    {
      "role": "Head of Demand Generation",
      "status": "unconfirmed",
      "people_count": 1
    },
    {
      "role": "CFO",
      "status": "found",
      "people_count": 1
    },
    {
      "role": "Head of Revenue Operations",
      "status": "not_found",
      "people_count": 0
    }
  ],
  "excluded": [],
  "rejected_count": 1,
  "contacts": [],
  "verdict": "Partial",
  "coverage_score": 2,
  "item_result": {
    "item": {
      "name": "Larkspur Ledger",
      "domain": "larkspur-ledger.example"
    },
    "item_key": "domain:larkspur-ledger.example",
    "item_label": "Larkspur Ledger (larkspur-ledger.example)",
    "status": "ok",
    "verdict": "Partial",
    "score": 2,
    "score_scale": "0-4",
    "headline": "2/4 roles found: Priya Example, Vice President, Marketing",
    "source_ids": [
      "S1"
    ]
  },
  "report": {
    "title": "Larkspur Ledger: people in target roles",
    "summary": "2 of 4 roles found: Priya Example (VP Marketing) and Sam Sample (CFO), both on the company's live team page. Head of Demand Generation is possibly stale (last seen June 2025); no Head of Revenue Operations was found.",
    "severity": "attention",
    "sections": [
      {
        "heading": "Found",
        "items": [
          {
            "text": "Priya Example, Vice President, Marketing (company team page, seen 2026-10-20; no dated source confirms the title).",
            "citations": [
              "S1"
            ],
            "confidence": "medium",
            "label": "VP Marketing"
          },
          {
            "text": "Sam Sample, Chief Financial Officer (company team page, seen 2026-10-20; appointed March 2025).",
            "citations": [
              "S1",
              "S2"
            ],
            "confidence": "high",
            "label": "CFO"
          }
        ]
      },
      {
        "heading": "Unconfirmed or adjacent",
        "items": [
          {
            "text": "Lee Placeholder, Head of Demand Generation: possibly stale, last seen as a speaker on 2025-06-12 and not on the current team page.",
            "citations": [
              "S3",
              "S1"
            ],
            "confidence": "low",
            "label": "Head of Demand Generation"
          }
        ]
      },
      {
        "heading": "Not found",
        "items": [
          {
            "text": "Head of Revenue Operations: no source names a holder at Larkspur Ledger.",
            "citations": []
          }
        ]
      }
    ],
    "sources": [
      {
        "id": "S1",
        "url": "https://larkspur-ledger.example/about/team",
        "title": "Our team | Larkspur Ledger",
        "provider": "firecrawl"
      },
      {
        "id": "S2",
        "url": "https://news.example.com/2025/03/larkspur-ledger-appoints-cfo",
        "title": "Larkspur Ledger appoints Sam Sample as CFO",
        "published_at": "2025-03-04",
        "provider": "tavily"
      },
      {
        "id": "S3",
        "url": "https://events.example.org/finops-summit-2025/speakers",
        "title": "FinOps Summit 2025 speakers",
        "published_at": "2025-06-12",
        "provider": "exa"
      }
    ],
    "unknowns": [
      "Rejected 1 candidate (same name at another company, or no company link).",
      "Head of Demand Generation: the only source is 16 months old; confirm Lee Placeholder still holds the role.",
      "Head of Revenue Operations: not on the team page and not named in any result."
    ],
    "meta": {
      "skill": "person-role-finder",
      "skill_version": "1.2.0",
      "generated_at": "2026-10-20T09:00:00Z"
    }
  }
}
